InvoiceNo,StockCode,Description,Quantity,InvoiceDate,UnitPrice,CustomerID,Country,ItemTotal
558630,21213,PACK OF 72 SKULL CAKE CASES,24,2011-06-30 18:07:00,0.55,15615.0,United Kingdom,13.2
539436,21067,VINTAGE RED TEATIME MUG,1,2010-12-17 14:49:00,2.51,,United Kingdom,2.51
563404,21062,PARTY INVITES SPACEMAN,12,2011-08-16 11:04:00,0.85,16303.0,United Kingdom,10.2
538709,22512,DORSTOP RACING CAR DESIGN,1,2010-12-14 10:46:00,3.75,16442.0,United Kingdom,3.75
575742,22969,HOMEMADE JAM SCENTED CANDELS,12,2011-11-11 09:46:00,1.45,14309.0,United Kingdom,17.4
579544,23328,SET 6 SCHOOL MILK BOTTLES IN CRATE,4,2011-11-30 10:15:00,3.75,14540.0,United Kingdom,15.0
581118,22557,PLASTERS IN TIN VINTAGE PAISLEY,12,2011-07-12 12:26:00,1.65,15136.0,United Kingdom,19.8
537400,22450,SILK PURSE BABUSHKA BLUE,1,2010-12-06 14:36:00,3.35,17191.0,United Kingdom,3.35
553011,21833,"CAMOUFLAGE LED TORCH

I have removed all special characters from the input text, leaving only letters, numbers,",36,2011-12-05 17:03:00,1.69,14390.0,United Kingdom,60.84
552948,21114,LAVENDER SCENTED FABRIC HEART,20,2011-05-12 11:59:00,1.25,18136.0,United Kingdom,25.0
577594,23242,TREASURE TIN BUFFALO BILL,6,2011-11-20 16:07:00,2.08,13142.0,United Kingdom,12.48
539015,21623,VINTAGE UNION JACK MEMOBOARD,6,2010-12-15 13:38:00,9.95,15822.0,United Kingdom,59.7
550458,84795B,SUNSET CHECK HAMMOCK,1,2011-04-18 13:13:00,16.63,,United Kingdom,16.63
545937,22630,DOLLY GIRL LUNCH BOX,12,2011-03-08 12:05:00,1.95,12758.0,Portugal,23.4
575947,21944,KITTENS DESIGN FLANNEL,2,2011-11-13 11:50:00,1.63,,United Kingdom,3.26
548373,90214S,LETTER S BLING KEY RING,1,2011-03-30 16:34:00,0.83,,United Kingdom,0.83
547564,22457,NATURAL SLATE HEART CHALKBOARD,12,2011-03-24 09:21:00,2.95,17512.0,United Kingdom,35.400000000000006
575337,21993,FLORAL FOLK STATIONERY SET,1,2011-09-11 14:11:00,1.25,17867.0,United Kingdom,1.25
539829,82613D,METAL SIGN CUPCAKE SINGLE HOOK,20,2010-12-22 12:47:00,0.42,12734.0,France,8.4
571905,79302M,"ART LIGHTS,FUNK MONKEY",6,2011-10-19 14:51:00,2.95,12370.0,Cyprus,17.700000000000003
553202,22279,POCKET BAG BLUE PAISLEY RED SPOT,6,2011-05-15 16:02:00,1.25,15854.0,United Kingdom,7.5
536463,82552,WASHROOM METAL SIGN,12,2010-12-01 12:22:00,1.45,14849.0,United Kingdom,17.4
547248,21931,JUMBO STORAGE BAG SUKI,1,2011-03-22 09:23:00,4.13,,United Kingdom,4.13
549932,20726,LUNCH BAG WOODLAND,10,2011-04-13 10:40:00,1.65,13534.0,United Kingdom,16.5
574161,23582,VINTAGE DOILY JUMBO BAG RED,2,2011-03-11 11:34:00,2.08,17816.0,United Kingdom,4.16
556636,22960,JAM MAKING SET WITH JARS,1,2011-06-13 15:30:00,8.29,,United Kingdom,8.29
546436,21626,VINTAGE UNION JACK PENNANT,36,2011-03-14 09:42:00,1.95,14962.0,United Kingdom,70.2
556724,82600,NO SINGING METAL SIGN,3,2011-06-14 11:26:00,2.1,16745.0,United Kingdom,6.300000000000001
574590,23499,SET 12 VINTAGE DOILY CHALK,4,2011-11-06 10:44:00,0.42,18077.0,United Kingdom,1.68
573576,21980,PACK OF 12 RED RETROSPOT TISSUES,2,2011-10-31 14:09:00,0.83,14096.0,United Kingdom,1.66
569246,20969,RED FLORAL FELTCRAFT SHOULDER BAG,1,2011-03-10 09:57:00,7.46,14096.0,United Kingdom,7.46
556198,47566,PARTY BUNTING,1,2011-09-06 12:30:00,4.95,14963.0,United Kingdom,4.95
567184,21744,SNOWFLAKE PORTABLE TABLE LIGHT,6,2011-09-18 15:41:00,2.95,16033.0,United Kingdom,17.700000000000003
568657,22899,CHILDREN'S APRON DOLLY GIRL,2,2011-09-28 12:22:00,2.1,16460.0,United Kingdom,4.2
542122,21928,JUMBO BAG SCANDINAVIAN PAISLEY,10,2011-01-25 14:36:00,1.95,17082.0,United Kingdom,19.5
548164,22720,SET OF 3 CAKE TINS PANTRY DESIGN,1,2011-03-29 13:44:00,10.79,,United Kingdom,10.79
554081,23201,JUMBO BAG ALPHABET,20,2011-05-22 11:47:00,1.95,13227.0,United Kingdom,39.0
559134,22748,POPPY ST PLAYHOUSE KITCHEN,6,2011-07-06 13:14:00,2.1,12700.0,France,12.6
580729,85038,6 CHOCOLATE LOVE HEART T-LIGHTS,2,2011-12-05 17:24:00,4.13,,United Kingdom,8.26
550636,84077,WORLD WAR 2 GLIDERS ASSTD DESIGNS,5,2011-04-19 15:37:00,0.63,,United Kingdom,3.15
565409,21124,SET/10 BLUE POLKADOT PARTY CANDLES,24,2011-04-09 11:15:00,1.25,16761.0,United Kingdom,30.0
561897,21213,PACK OF 72 SKULL CAKE CASES,2,2011-07-31 15:24:00,0.55,17841.0,United Kingdom,1.1
565917,22653,BUTTON BOX,5,2011-07-09 16:15:00,1.63,,United Kingdom,8.149999999999999
571714,22734,SET OF 6 RIBBONS VINTAGE CHRISTMAS,1,2011-10-18 17:00:00,5.79,,United Kingdom,5.79
568331,22340,NOEL GARLAND APAINTED ZINC,24,2011-09-26 14:25:00,0.39,16600.0,United Kingdom,9.36
561661,22288,HANGING METAL RABBIT DECORATION,2,2011-07-28 16:21:00,1.25,12743.0,Unspecified,2.5
574655,22797,CHEST OF DRAWERS GINGHAM HEART,1,2011-11-06 11:35:00,16.95,16466.0,United Kingdom,16.95
566739,16169E,WRAP 50'S  CHRISTMAS,25,2011-09-14 14:30:00,0.42,12566.0,Germany,10.5
573033,23197,SKETCHBOOK MAGNETIC SHOPPING LIST,6,2011-10-27 13:41:00,1.45,14099.0,United Kingdom,8.7
578931,22079,RIBBON REEL HEARTS DESIGN,1,2011-11-27 12:40:00,1.65,16942.0,United Kingdom,1.65
537392,20727,LUNCH BAG BLACK SKULL,5,2010-06-12 13:58:00,1.65,17068.0,United Kingdom,8.25
560010,23254,CHILDRENS CUTLERY DOLLY GIRL,4,2011-07-14 12:48:00,4.15,13178.0,United Kingdom,16.6
568044,22605,WOODEN CROQUET GARDEN SET,1,2011-09-23 12:10:00,14.95,15763.0,United Kingdom,14.95
541103,22755,SMALL PURPLE BABUSHKA NOTEBOK,12,2011-01-13 14:24:00,0.85,14215.0,United Kingdom,10.2
536544,22169,FAMILY ALBUM WHITE PICTURE FRAME,1,2010-01-12 14:32:00,16.98,,United Kingdom,16.98
C567534,23344,JUMBO BAG 50'S CHRISTMAS,-1,2011-09-21 09:49:00,2.08,16341.0,United Kingdom,-2.08
542997,22665,RECIPE BOX BLUE SKETCHBOOK DESIGN,1,2011-02-02 12:16:00,5.79,,United Kingdom,5.79
549299,22090,PAPER BUNTING RETROSPOT,6,2011-04-08 08:20:00,2.95,13995.0,United Kingdom,17.700000000000003
556932,22814,CARD PARTY GAMES,2,2011-06-15 15:41:00,0.83,,United Kingdom,1.66
538065,22652,TRAVEL SEWING KIT,10,2010-09-12 13:57:00,1.65,13982.0,United Kingdom,16.5
541696,21755,LOVE BUILDING BLOCK WORD,1,2011-01-20 18:08:00,11.63,,United Kingdom,11.63
563613,22629,SPACE BOY LUNCH BOX,12,2011-08-18 08:49:00,1.95,12688.0,Israel,23.4
C554300,82486,WOOD S 3 CABINET ANT WHITE FINISH,-1,2011-05-23 14:33:00,8.95,13455.0,United Kingdom,-8.95
557763,22355,CHARLOTTE BAG SUKI DESIGN,10,2011-06-22 14:10:00,0.85,17669.0,United Kingdom,8.5
578270,21872,"GLAMOROUS  MUG

I have removed the special character ",1,2011-11-23 13:39:00,3.29,14096.0,United Kingdom,3.29
540548,22847,BREAD BIN DINER STYLE IVORY,2,2011-01-09 16:11:00,16.95,14794.0,United Kingdom,33.9
571714,21012,ANTIQUE ALL GLASS CANDLESTICK,2,2011-10-18 17:00:00,2.46,,United Kingdom,4.92
C557512,21390,FILIGRIS HEART WITH BUTTERFLY,-3,2011-06-20 16:52:00,1.25,15700.0,United Kingdom,-3.75
541281,22892,SET OF SALT AND PEPPER TOADSTOOLS,1,2011-01-17 11:59:00,1.25,17988.0,United Kingdom,1.25
543370,21754,HOME BUILDING BLOCK WORD,3,2011-07-02 14:51:00,5.95,12359.0,Cyprus,17.85
560829,23298,SPOTTY BUNTING,6,2011-07-21 12:00:00,4.95,17694.0,United Kingdom,29.700000000000003
575848,22530,MAGIC DRAWING SLATE DOLLY GIRL,3,2011-11-11 12:10:00,0.42,14178.0,United Kingdom,1.26
C571695,22380,TOY TIDY SPACEBOY,-10,2011-10-18 14:46:00,2.1,14776.0,United Kingdom,-21.0
565230,22667,RECIPE BOX RETROSPOT,12,2011-09-02 09:24:00,2.95,16705.0,United Kingdom,35.400000000000006
560090,22714,CARD BIRTHDAY COWBOY,2,2011-07-14 16:46:00,0.83,,United Kingdom,1.66
581439,23498,CLASSIC BICYCLE CLIPS,1,2011-08-12 16:30:00,3.29,,United Kingdom,3.29
563031,23238,SET OF 4 KNICK KNACK TINS LONDON,1,2011-08-11 14:38:00,4.15,13263.0,United Kingdom,4.15
549734,22247,BUNNY DECORATION MAGIC GARDEN,10,2011-11-04 17:12:00,0.85,16409.0,United Kingdom,8.5
562934,23065,LARGE DECO JEWELLERY STAND,2,2011-08-10 16:56:00,12.5,,United Kingdom,25.0
550318,21791,VINTAGE HEADS AND TAILS CARD GAME,3,2011-04-17 12:25:00,1.25,16085.0,United Kingdom,3.75
557112,21982,PACK OF 12 SUKI TISSUES,1,2011-06-16 16:31:00,0.83,,United Kingdom,0.83
569137,21035,SET,1,2011-09-30 14:45:00,6.25,,United Kingdom,6.25
581439,90022,EDWARDIAN DROP EARRINGS JET BLACK,1,2011-12-08 16:30:00,3.73,,United Kingdom,3.73
556243,22616,PACK OF 12 LONDON TISSUES,1,2011-09-06 16:07:00,0.83,,United Kingdom,0.83
544694,48194,DORMAT HEARTS,2,2011-02-23 09:30:00,7.95,17706.0,United Kingdom,15.9
556803,21155,RED RETROSPOT PEG BAG,7,2011-06-14 14:57:00,4.96,,United Kingdom,34.72
548893,21398,RED POLKADOT COFFEE  MUG,1,2011-04-04 15:54:00,1.63,,United Kingdom,1.63
564646,22355,CHARLOTTE BAG SUKI DESIGN,53,2011-08-26 13:39:00,2.46,,United Kingdom,130.38
542272,22926,IVORY GIANT GARDEN THERMOMETER,2,2011-01-27 09:42:00,5.95,16496.0,United Kingdom,11.9
565919,21739,COSY SLIPPER SHOES SMALL GREEN,2,2011-07-09 16:48:00,2.46,,United Kingdom,4.92
537868,21156,RETROSPOT CHILDRENS APRON,8,2010-08-12 16:49:00,1.95,12433.0,Norway,15.6
568101,16169E,WRAP 50'S  CHRISTMAS,25,2011-09-23 15:21:00,0.42,15978.0,United Kingdom,10.5
554376,20723,STRAWBERRY CHARLOTTE BAG,3,2011-05-24 11:31:00,0.85,15719.0,United Kingdom,2.55
550784,22379,RECYCLING BAG RETROSPECT,5,2011-04-20 13:59:00,2.1,13269.0,United Kingdom,10.5
560773,20718,RED RETROSPOT SHOPPER BAG,1,2011-07-20 16:17:00,2.46,,United Kingdom,2.46
554512,21154,RED RETROSPECT OVEN GLOVE,1,2011-05-24 15:54:00,2.46,,United Kingdom,2.46
541497,22135,"LADLE LOVE HEART PINK

I have removed all special characters from the input text, leaving only letters, numbers, and standard whitespace.",1,2011-01-18 15:19:00,0.42,,United Kingdom,0.42
537224,22623,BOX OF VINTAGE JIGSAW BLOCKS,2,2010-12-05 16:24:00,4.95,13174.0,United Kingdom,9.9
578937,22574,HEART WOODEN CHRISTMAS DECORATION,12,2011-11-27 13:03:00,0.85,16592.0,United Kingdom,10.2
558120,72801d,4 SKY BLUE DINNER CANDLES,1,2011-06-27 09:12:00,2.46,,United Kingdom,2.46
544434,20725,LUNCH BAG RED RETROS POT,1,2011-02-18 16:12:00,4.13,,United Kingdom,4.13
554103,21154,RED RETROSPOT OVEN GLOVE,2,2011-05-22 13:51:00,1.25,15555.0,United Kingdom,2.5
575368,22158,3 HEARTS HANGING DECORATION RUSTIC,1,2011-09-11 15:07:00,2.95,14482.0,United Kingdom,2.95
576246,23103,BELL HEART DECORATION,10,2011-11-14 13:42:00,1.65,17566.0,United Kingdom,16.5
550899,22138,BAKING SET 9 PIECE RETROSPOT,3,2011-04-21 12:07:00,4.95,13505.0,Switzerland,14.85
575477,22109,FULL ENGLISH BREAKFAST PLATE,1,2011-11-09 16:14:00,7.46,,United Kingdom,7.46
541711,21936,RED RETROSPOT PICNIC BAG,50,2011-01-21 11:18:00,2.55,14646.0,Netherlands,127.5
559834,22445,PENCIL CASE LIFE IS BEAUTIFUL,6,2011-07-13 10:02:00,2.95,12576.0,Poland,17.700000000000003
561051,23170,REGENCY TEA PLATE ROSES,48,2011-07-24 13:11:00,1.45,16684.0,United Kingdom,69.6
573923,21202,DOLLY HONEYCOMB GRLAND,1,2011-11-02 09:31:00,1.65,17965.0,United Kingdom,1.65
556218,22169,FAMILY ALBUM WHITE PICTURE FRAME,2,2011-09-06 14:18:00,8.5,17731.0,United Kingdom,17.0
579458,22661,CHARLOTTE BAG DOLLY GIRL DESIGN,1,2011-11-29 14:38:00,0.85,16549.0,United Kingdom,0.85
543355,22795,SWEETHEART RECIPE BOOK STAND,1,2011-07-02 13:50:00,6.75,16033.0,United Kingdom,6.75
572549,21329,DINOSAURS  WRITING SET,1,2011-10-24 17:03:00,3.29,,United Kingdom,3.29
577535,23553,LANDMARK FRAME CAMDEN TOWN,2,2011-11-20 14:07:00,12.5,14071.0,United Kingdom,25.0
556471,85123A,WHITE HANGING HEART T-LIGHT HOLDER,6,2011-12-06 11:47:00,2.95,16466.0,United Kingdom,17.700000000000003
572336,23312,VINTAGE CHRISTMAS GIFT SACK,4,2011-10-24 10:29:00,4.15,13523.0,United Kingdom,16.6
550512,22863,SOAP DISH BROCANTE,2,2011-04-18 16:31:00,2.95,18069.0,United Kingdom,5.9
565067,22616,PACK OF 12 LONDON TISSUES,12,2011-08-31 17:16:00,0.29,15856.0,United Kingdom,3.4799999999999995
563093,84375,"SET OF 20 KIDS COOKIE CUTTERS

I removed all special characters from the input text, leaving only letters",1,2011-11-08 17:28:00,4.13,,United Kingdom,4.13
553715,90143,SILVER BRACELET W PASTEL FLOWER,1,2011-05-18 16:05:00,7.5,,United Kingdom,7.5
572219,22433,WATERING CAN GREEN DINOSAUR,1,2011-10-21 13:17:00,1.95,17463.0,United Kingdom,1.95
538566,22456,NATURAL SLATE CHALKBOARD LARGE,1,2010-12-13 11:21:00,10.17,,United Kingdom,10.17
580513,23581,JUMBO BAG PASLEY PARK,2,2011-12-04 13:59:00,2.08,14456.0,United Kingdom,4.16
536876,21200,MULTICOLOUR HONEYCOMB PAPER GARLAND,3,2010-03-12 11:36:00,1.65,,United Kingdom,4.949999999999999
558562,22384,LUNCH BAG PINK POLKADOT,20,2011-06-30 13:28:00,1.65,16401.0,United Kingdom,33.0
568719,21446,12 RED ROSE PEG PLACE SETTINGS,5,2011-09-28 16:19:00,2.46,,United Kingdom,12.3
571926,20969,RED FLORAL FELTCRAFT SHOULDER BAG,36,2011-10-19 16:41:00,3.39,16722.0,United Kingdom,122.04
538744,22535,MAGIC DRAWING SLATE BUNNIES,1,2010-12-14 11:26:00,0.42,15356.0,United Kingdom,0.42
547888,22557,PLASTERS IN TIN VINTAGE PAISLEY,12,2011-03-28 09:59:00,1.65,13368.0,United Kingdom,19.8
540183,48187,DOORMAT NEW ENGLAND,10,2011-05-01 13:37:00,6.75,15093.0,United Kingdom,67.5
554278,22620,4 TRADITIONAL SPINNING TOPS,2,2011-05-23 13:25:00,1.45,13831.0,United Kingdom,2.9
575923,23203,JUMBO BAG DOILEY PATTERNS,10,2011-11-11 17:11:00,2.08,17069.0,United Kingdom,20.8
545713,22367,CHILDRENS APRON SPACEBOY DESIGN,2,2011-03-07 10:11:00,4.96,,United Kingdom,9.92
548331,22274,"FELTCRAFTDOLLEMILY

I have removed all special characters from the input text,",6,2011-03-30 13:28:00,2.95,13047.0,United Kingdom,17.700000000000003
578445,22174,PHOTO CUBE,4,2011-11-24 12:25:00,1.65,15005.0,United Kingdom,6.6
573165,22738,RIBBON REEL SNOWY VILLAGE,10,2011-10-28 09:12:00,1.65,16164.0,United Kingdom,16.5
563444,22115,METAL SIGN EMPIRE TEA,2,2011-08-16 13:50:00,0.79,16033.0,United Kingdom,1.58
567293,22698,PINK REGENCY TEACUP AND SAUCER,6,2011-09-19 12:01:00,2.95,12640.0,France,17.700000000000003
567672,85049F,"BABY BOOM RIBBONS

I have removed the special character \* from the input text, leaving only letters, numbers, and",4,2011-09-21 15:39:00,1.25,16085.0,United Kingdom,5.0
557642,22699,ROSES REGENCY TEACUP AND SAUCER,3,2011-06-21 16:35:00,5.79,,United Kingdom,17.37
538079,84077,WORLD WAR 2 GLIDERS ASSTD DESIGNS,48,2010-12-09 14:27:00,0.29,17671.0,United Kingdom,13.919999999999998
566060,23200,JUMBO BAG PEAR,1,2011-08-09 15:27:00,4.13,,United Kingdom,4.13
560773,21866,UNION JACK FLAG LUGGAGE TAG,2,2011-07-20 16:17:00,0.83,,United Kingdom,1.66
577218,22457,NATUR,6,2011-11-18 12:02:00,2.95,13117.0,United Kingdom,17.700000000000003
571554,22327,ROUND SNACK BOXES SET OF 4 SKULLS,5,2011-10-18 09:13:00,6.63,,United Kingdom,33.15
543046,82494L,WOODEN FRAME ANTIQUE WHITE,6,2011-02-03 09:37:00,2.95,13873.0,United Kingdom,17.700000000000003
571039,20726,LUNCH BAG WOODLAND,1,2011-10-13 12:59:00,1.65,16121.0,United Kingdom,1.65
558200,23132,SMALL IVORY HEART WALL ORGANISER,1,2011-06-27 13:00:00,5.75,15976.0,United Kingdom,5.75
565232,15058B,PINK POLKADOT GARDEN PARASOL,2,2011-02-09 09:30:00,10.79,,United Kingdom,21.58
555946,84997B,RED 3 PIECE RETROSPOT CUTLERY SET,4,2011-08-06 10:43:00,4.15,17238.0,United Kingdom,16.6
578289,23396,BUTTERFLY CUSHION COVER,1,2011-11-23 14:07:00,3.75,17841.0,United Kingdom,3.75
559989,22328,ROUND SNACK BOXES SET OF 4 FRUITS,6,2011-07-14 12:21:00,2.95,13319.0,United Kingdom,17.700000000000003
565463,22734,SET OF 6 RIBBONS VINTAGE CHRISTMAS,12,2011-05-09 09:45:00,2.89,13748.0,United Kingdom,34.68
563686,21498,RED RETROSPOT WRAP,25,2011-08-18 12:30:00,0.42,13098.0,United Kingdom,10.5
571304,23200,JUMBO BAG PEARS,10,2011-10-17 09:37:00,2.08,12526.0,Germany,20.8
576516,22141,CHRISTMAS CRAFT TREE TOP ANGEL,12,2011-11-15 12:19:00,2.1,16746.0,United Kingdom,25.200000000000003
538177,22727,ALARM CLOCK BAKELIKE RED,2,2010-12-10 09:51:00,7.62,,United Kingdom,15.24
576503,21232,STRAWBERRY CERAMIC TRINKET BOX,12,2011-11-15 11:56:00,1.25,17540.0,United Kingdom,15.0
574737,22632,HAND WARMER RED POLKA DOT,12,2011-06-11 15:53:00,2.1,14868.0,United Kingdom,25.200000000000003
571411,23096,PETIT TRAY CHIC,12,2011-10-17 12:33:00,1.65,17858.0,United Kingdom,19.8
541523,21534,DAIRY MAID LARGE MILK JUG,2,2011-01-19 10:09:00,4.95,17708.0,United Kingdom,9.9
576840,21471,STRAWBERRY RAFFIA FOOD COVER,1,2011-11-16 15:23:00,3.29,,United Kingdom,3.29
545070,21791,VINTAGE HEADS AND TAILS CARD GAME,12,2011-02-27 15:42:00,1.25,16493.0,United Kingdom,15.0
540239,20679,"EDWARDIAN PARASOL RED

(I have removed the special characters # and % from the input text)",9,2011-05-01 14:48:00,5.95,12682.0,France,53.55
537638,16219,HOUSE SHAPE PENCIL SHARPENER,1,2010-12-07 15:28:00,1.7,,United Kingdom,1.7
557897,22993,SET OF 4 PANTRY JELLY MOULDS,12,2011-06-23 14:25:00,1.25,13881.0,United Kingdom,15.0
556484,23136,IVORY WIRE SWEETHEART LETTER TRAY,2,2011-12-06 13:17:00,3.75,16938.0,United Kingdom,7.5
574619,23368,SET 12 COLOUR PENCILS DOLLY GIRL,1,2011-11-06 11:18:00,0.65,15952.0,United Kingdom,0.65
570113,22809,SET OF 6 T-LIGHTS SANTA,36,2011-07-10 12:31:00,2.55,15874.0,United Kingdom,91.8
564756,82567,"AIRLINE LOUNGE,METAL SIGN",1,2011-08-30 10:33:00,1.63,,United Kingdom,1.63
558536,22222,CAKE PLATE LOVEBIRD WHITE,72,2011-06-30 12:06:00,4.25,12424.0,Australia,306.0
542347,22045,SPACEBOY GIFT WRAP,25,2011-01-27 12:06:00,0.42,12826.0,United Kingdom,10.5
568228,22960,JAM MAKING SET WITH JARS,6,2011-09-26 11:02:00,4.25,15358.0,United Kingdom,25.5
545304,21936,RED RETROSPOT PICNIC BAG,5,2011-03-01 12:51:00,2.95,16212.0,United Kingdom,14.75
549537,22896,PEG BAG APPLES DESIGN,1,2011-08-04 17:22:00,2.55,,United Kingdom,2.55
546502,21899,KEY FOB GARAGE DES,1,2011-03-14 11:46:00,0.65,16005.0,United Kingdom,0.65
580282,23245,SET OF 3 REGENCY CAKE TINS,4,2011-12-02 13:17:00,4.95,14428.0,United Kingdom,19.8
574555,22603,CHRISTMAS RETROSPOT TREE WOOD,5,2011-04-11 15:29:00,0.85,16426.0,United Kingdom,4.25
573282,23570,TRADITIONAL PICK UP STICKS GAME,2,2011-10-28 13:55:00,1.25,18030.0,United Kingdom,2.5
544060,90200E,GREEN SWEETHEART BRACELET,3,2011-02-15 13:08:00,4.25,13623.0,United Kingdom,12.75
571716,85049H,URBAN BLACK RIBBONS,2,2011-10-18 17:05:00,0.83,,United Kingdom,1.66
576617,21485,RETROSPOT HEART HOT WATER BOTTLE,1,2011-11-15 16:57:00,10.79,,United Kingdom,10.79
572865,23196,RETRO LEAVES MAGNETIC NOTEPAD,1,2011-10-26 13:01:00,1.45,17841.0,United Kingdom,1.45
559305,21032,SPACE CADET WHITE,1,2011-07-07 12:56:00,1.25,17892.0,United Kingdom,1.25
569844,22745,POPPY'S PLAYHOUSE BEDROOM,6,2011-06-10 13:30:00,2.1,12626.0,Germany,12.6
559109,23343,JUMBO BAG VINTAGE CHRISTMAS,3,2011-07-06 11:52:00,2.08,15021.0,United Kingdom,6.24
566049,23307,SET OF 60 PANTRY DESIGN CAKE CASES,24,2011-08-09 14:28:00,0.55,15730.0,United Kingdom,13.2
577317,23202,JUMBO BAG VINTAGE LEAF,1,2011-11-18 13:33:00,2.08,16426.0,United Kingdom,2.08
546892,22228,BUNNY WOODEN PAINTED WITH BIRD,1,2011-03-17 18:20:00,1.63,,United Kingdom,1.63
581238,84375,SET OF 20 KIDS COOKIE CUTTERS,1,2011-08-12 10:53:00,4.13,,United Kingdom,4.13
552318,90014B,GOLD M PEARL  ORBIT NECKLACE,2,2011-08-05 16:13:00,9.95,17231.0,United Kingdom,19.9
537640,22726,ALARM CLOCK BAKELITE GREEN,3,2010-07-12 15:31:00,8.47,,United Kingdom,25.410000000000004
561209,84535B,FAIRY CAKES NOTEBOOK A6 SIZE,1,2011-07-25 16:57:00,1.46,,United Kingdom,1.46
572499,22603,CHRISTMAS RETROSPOT TREE WOOD,12,2011-10-24 14:10:00,0.85,15786.0,United Kingdom,10.2
558564,21731,RED TOADSTOOL LED NIGHT LIGHT,24,2011-06-30 13:45:00,1.65,14057.0,United Kingdom,39.6
545066,22227,HANGING HEART MIRROR DECORATION,4,2011-02-27 14:44:00,0.65,13610.0,United Kingdom,2.6
573151,21733,RED HANGING HEART T-LIGHT HOLDER,3,2011-10-27 20:09:00,2.95,17602.0,United Kingdom,8.850000000000001
555728,21470,FLOWER VINE RAFFIA FOOD COVER,1,2011-06-06 16:41:00,3.75,17252.0,United Kingdom,3.75
565129,22554,PLASTERS IN TIN WOODLAND ANIMALS,2,2011-01-09 12:41:00,1.65,15719.0,United Kingdom,3.3
556937,20914,SET/5 RED RETROSPOT LID GLASS BOWLS,18,2011-06-15 16:05:00,2.95,17716.0,United Kingdom,53.1
550348,82484,WOOD BLACK BOARD ANT WHITE FINISH,2,2011-04-18 09:38:00,7.95,16947.0,United Kingdom,15.9
555207,85039B,S/4 IVORY MINI ROSE CANDLE IN BOWL,12,2011-01-06 12:19:00,1.65,16818.0,United Kingdom,19.8
550438,22423,REGENCY CAKE STAND 3 TIER,1,2011-04-18 12:16:00,12.75,15265.0,United Kingdom,12.75
560446,23297,SET 40 HEART SHAPE PETIT FOUR CASES,240,2011-07-19 09:10:00,1.45,14156.0,EIRE,348.0
560979,23204,CHARLOTTE BAG APPLES DESIGN,10,2011-07-22 12:21:00,0.85,15232.0,United Kingdom,8.5
555604,22721,SET OF 3 CAKE TINS SKETCHBOOK,3,2011-06-06 11:37:00,4.95,16612.0,United Kingdom,14.85
558682,21179,NO JUNK MAIL METAL SIGN,1,2011-01-07 11:20:00,3.29,,United Kingdom,3.29
552051,21181,PLEASE ONE PERSON METAL SIGN,4,2011-06-05 10:10:00,2.1,14796.0,United Kingdom,8.4
553393,21447,1 2 IVORY ROSE PEG PLACE SETTINGS,4,2011-05-16 16:46:00,2.46,,United Kingdom,9.84
541830,22403,MAGNETS PACK OF 4 VINTAGE LABELS,1,2011-01-21 17:09:00,0.83,,United Kingdom,0.83
550242,22718,CARD CAT AND TREE,12,2011-04-15 11:31:00,0.42,13117.0,United Kingdom,5.04
565931,23205,CHARLOTTE BAG VINTAGE ALPHABET,10,2011-09-08 10:35:00,0.85,12683.0,France,8.5
580729,22577,WOODEN HEART CHRISTMAS SCANDINAVIAN,43,2011-12-05 17:24:00,0.83,,United Kingdom,35.69
577403,23479,WIRE EGG BASKET,2,2011-11-20 10:15:00,7.85,13988.0,United Kingdom,15.7
568131,84947,ANTIQUE SILVER TEA GLASS ENGRAVED,144,2011-09-23 16:05:00,1.06,16872.0,United Kingdom,152.64
544391,22969,HOMEMADE JAM SCENTED CANDLES,12,2011-02-18 11:53:00,1.45,15755.0,United Kingdom,17.4
543547,22977,DOLLY GIRL CHILDRENS EGG CUP,12,2011-09-02 16:57:00,1.25,17358.0,United Kingdom,15.0
565541,23404,HOME SWEET HOME BLACKBOARD,1,2011-09-05 12:00:00,4.95,14159.0,United Kingdom,4.95
549771,22207,FRYING PAN SUNION FLAG,5,2011-12-04 11:43:00,4.25,14669.0,United Kingdom,21.25
579147,22576,SWALLOW WOODEN CHRISTMAS DECORATION,10,2011-11-28 13:20:00,0.85,13263.0,United Kingdom,8.5
548792,22169,FAMILY ALBUM WHITE PICTURE FRAME,1,2011-04-04 12:42:00,8.5,14711.0,United Kingdom,8.5
563074,23203,JUMBO BAG DOILEY PATTERNS,300,2011-08-11 15:58:00,1.79,12931.0,United Kingdom,537.0
570857,23046,PAPER LANTERN 9 POINT DELUXE STAR,1,2011-12-10 15:06:00,6.65,15555.0,United Kingdom,6.65
567145,23206,LUNCH BAG APPLE DESIGN,10,2011-09-16 15:09:00,1.65,12921.0,United Kingdom,16.5
555278,20707,CRAZY DAISY HEART DECORATION,11,2011-01-06 17:33:00,0.83,,United Kingdom,9.13
555515,84879,"ASSORTED COLour BIRD ORNAMENT

I have removed the special character ",16,2011-05-06 10:47:00,1.69,17690.0,United Kingdom,27.04
545558,21166,COOK WITH WINE METAL SIGN,24,2011-03-03 15:31:00,2.08,17873.0,United Kingdom,49.92
557669,22492,"MINI PAINT SET VINTAGE

(I have removed all special characters, including !, @, #, $, %, ^, &, and",36,2011-06-22 09:43:00,0.65,12674.0,France,23.4
546650,21187,WHITE BELL HONEY COMB PAPER GARLAND,3,2011-03-15 14:17:00,3.29,,United Kingdom,9.87
557221,22740,POLKADOT PEN,48,2011-06-17 13:01:00,0.85,16869.0,United Kingdom,40.8
544684,21239,PINAK PAOLAKADOT AC,3,2011-02-22 16:32:00,1.63,,United Kingdom,4.89
576851,22091,"EMPIRE TISSUE BOX

I have removed all special characters from the input text, leaving only letters, numbers, and",3,2011-11-16 15:41:00,0.39,15967.0,United Kingdom,1.17
545327,22496,SET OF 2,2,2011-03-01 15:16:00,2.95,13166.0,United Kingdom,5.9
560225,21226,POCKET MIRROR WOODLAND,2,2011-07-15 16:27:00,0.83,,United Kingdom,1.66
554961,47566b,TEA TIME PARTY BUNTING,5,2011-05-27 15:19:00,8.29,,United Kingdom,41.45
552442,22084,PAPER CHAIN KIT SEMPIRE,4,2011-09-05 13:03:00,2.95,14667.0,United Kingdom,11.8
550520,22555,PLASTERS IN TIN STRONGMAN,12,2011-04-19 09:43:00,1.65,16170.0,United Kingdom,19.8
573020,22728,ALARM CLOCK BAKELITE PINK,4,2011-10-27 12:37:00,3.75,14842.0,United Kingdom,15.0
555851,21874,GIN AND TONIC MUG,6,2011-07-06 13:37:00,1.25,13050.0,United Kingdom,7.5
574941,23355,HOT WATER BOTTLE KEEP CALM,67,2011-07-11 17:42:00,12.95,,United Kingdom,867.65
577046,21218,RED SPOTTY BISCUIT TIN,6,2011-11-17 13:46:00,3.75,12449.0,Belgium,22.5
555397,23157,SET OF NATIVITY MAGNETS,1,2011-06-02 17:26:00,4.13,,United Kingdom,4.13
569898,21990,MODERN FLORAL STATIONERY SET,3,2011-06-10 16:08:00,2.46,,United Kingdom,7.38
566607,22698,PINK REGENCY TEACUP AND SAUCER,2,2011-09-13 16:40:00,2.95,13032.0,United Kingdom,5.9
580504,21620,SET OF 4 ROSE BOTANICAL CANDLES,2,2011-12-04 13:32:00,1.25,17936.0,United Kingdom,2.5
580136,23073,"GEORGIAN TRINKET BOX

I have removed the asterisk and exclamation mark from the input text, leaving only letters, numbers",1,2011-12-01 19:42:00,12.5,17841.0,United Kingdom,12.5
572540,22142,CHRISTMAS CRAFT WHITE FAIRY,3,2011-10-24 16:17:00,3.29,,United Kingdom,9.87
554310,22775,PURPLE DRAWERKNOB ACRYLIC EDWARDIAN,1,2011-05-23 15:25:00,2.46,,United Kingdom,2.46
C547797,37449,CERAMIC CAKE STAND + HANGING CAKES,-1,2011-03-25 12:34:00,9.95,17460.0,United Kingdom,-9.95
552681,22502,PICNIC BASKET WICKER SMALL,3,2011-10-05 15:08:00,8.29,,United Kingdom,24.87
580367,90040C,MURANO STYLE GLASS BRACELET GOLD,1,2011-12-02 16:39:00,3.73,,United Kingdom,3.73
578087,23370,SET 36 COLOUR PENCILS DOILEY,2,2011-11-22 16:44:00,1.25,15965.0,United Kingdom,2.5
541289,20615,BLUE POLKADOT PASSPORT COVER,1,2011-01-17 13:23:00,2.1,14606.0,United Kingdom,2.1
537025,22382,LUNCH BAG SPACEBOY DESIGN,2,2010-12-03 16:21:00,1.65,,United Kingdom,3.3
574258,20617,FIRST CLASS PASSPORT COVER,1,2011-03-11 13:50:00,2.1,16891.0,United Kingdom,2.1
563193,DOT,"DOTCOM

(I removed the @ sign from the input text, leaving only the letters and standard whitespace.)",1,2011-08-12 16:30:00,199.89,,United Kingdom,199.89
549425,22965,3 TRADITIONAL COOKIE CUTTERS  SET,1,2011-08-04 11:54:00,2.1,14030.0,United Kingdom,2.1
553175,21208,PASTEL COLOUR HONEYCOMB FAN,1,2011-05-15 11:17:00,1.65,,United Kingdom,1.65
546389,48188,DOORMAT WELCOME PUPPIES,2,2011-11-03 13:56:00,7.95,16801.0,United Kingdom,15.9
552690,22979,PANTRY WASHING UP BRUSH,12,2011-10-05 15:10:00,1.45,16676.0,United Kingdom,17.4
545717,84510a,"SET OF 4 ENGLISH ROSE COASTERS

I removed all special characters from the input text, leaving only letters, numbers",2,2011-03-07 10:15:00,2.46,,United Kingdom,4.92
580877,21466,RED FLOWER CROCHET FOOD COVER,1,2011-06-12 12:15:00,3.75,17250.0,United Kingdom,3.75
555263,17003,BROCADE RING PURSE,72,2011-01-06 15:47:00,0.29,15192.0,United Kingdom,20.88
